{"schemaVersion":2,"contract":"paper-history-list","requestId":"request-synthetic","asOf":"2026-10-14T08:00:00+00:00","items":[{"attestationId":"history-synthetic","walletId":"wallet-synthetic","instrumentId":"instrument-synthetic","instrumentSpecVersionId":"spec-synthetic","openingKnownFlat":true,"allManualFillsRecorded":true,"fromOccurredAtUtc":"2026-10-13T08:00:00+00:00","throughOccurredAtUtc":"2026-10-14T08:00:00+00:00","source":"userDeclaredPaperHistory","recordedByUserId":"user-synthetic","quality":"userDeclaredComplete","knownAtUtc":"2026-10-14T08:00:00+00:00","publicationSequence":3,"rootAttestationId":"history-synthetic","revision":1,"replacesAttestationId":null,"correctionReason":null,"replacedByAttestationId":null}],"nextCursor":null,"publicationWatermark":3,"snapshotCursor":"synthetic-history-snapshot","streamRevision":3}
